{
  "after": [
    {
      "column_count": 1,
      "major_dimension": "ROWS",
      "range": "MCP_ALT_MLL_2025.08_min_formula!I6",
      "row_count": 1,
      "values": [
        [
          "=ARRAYFORMULA(MMULT(N($C$6:$C$129=TRANSPOSE('3. MLL_광고비 현황-2025.08'!$D$2:$D$242)),N('3. MLL_광고비 현황-2025.08'!$E$2:$E$242)))"
        ]
      ]
    },
    {
      "column_count": 1,
      "major_dimension": "ROWS",
      "range": "MCP_ALT_MLL_2025.08_min_formula!M6",
      "row_count": 1,
      "values": [
        [
          "=ARRAYFORMULA(MMULT(N($C$6:$C$129=TRANSPOSE('2. MLL_SKU별 성과 현황-2025.08'!$C$4:$C$1002)),N('2. MLL_SKU별 성과 현황-2025.08'!$H$4:$AL$1002)))"
        ]
      ]
    },
    {
      "column_count": 1,
      "major_dimension": "ROWS",
      "range": "MCP_ALT_MLL_2025.08_min_formula!M3",
      "row_count": 1,
      "values": [
        [
          "=ARRAYFORMULA(M4:AQ4-BYCOL(FILTER(M6:AQ129,REGEXMATCH($B$6:$B$129,\"언어\")),LAMBDA(c,SUM(c))))"
        ]
      ]
    }
  ],
  "artifacts": [
    {
      "kind": "google_auth",
      "summary": {
        "mode": "user_oauth"
      }
    }
  ],
  "before": [
    {
      "column_count": 1,
      "major_dimension": "ROWS",
      "range": "MCP_ALT_MLL_2025.08_min_formula!I6",
      "row_count": 1,
      "values": [
        [
          "=MMULT(N($C$6:$C$129=TRANSPOSE('3. MLL_광고비 현황-2025.08'!$D$2:$D$242)),N('3. MLL_광고비 현황-2025.08'!$E$2:$E$242))"
        ]
      ]
    },
    {
      "column_count": 1,
      "major_dimension": "ROWS",
      "range": "MCP_ALT_MLL_2025.08_min_formula!M6",
      "row_count": 1,
      "values": [
        [
          "=MMULT(N($C$6:$C$129=TRANSPOSE('2. MLL_SKU별 성과 현황-2025.08'!$C$4:$C$1002)),N('2. MLL_SKU별 성과 현황-2025.08'!$H$4:$AL$1002))"
        ]
      ]
    },
    {
      "column_count": 1,
      "major_dimension": "ROWS",
      "range": "MCP_ALT_MLL_2025.08_min_formula!M3",
      "row_count": 1,
      "values": [
        [
          "=ARRAYFORMULA(M4:AQ4-MMULT(TRANSPOSE(N(REGEXMATCH($B$6:$B$129,\"언어\"))),N(M6:AQ129)))"
        ]
      ]
    }
  ],
  "captured_at": "2026-06-05T15:27:36.092148+00:00",
  "operation": "apply.values_update",
  "requested_ranges": [
    "'MCP_ALT_MLL_2025.08_min_formula'!I6",
    "'MCP_ALT_MLL_2025.08_min_formula'!M6",
    "'MCP_ALT_MLL_2025.08_min_formula'!M3"
  ],
  "rollback": {
    "operation": "rollback.values_restore",
    "ranges": [
      "'MCP_ALT_MLL_2025.08_min_formula'!I6",
      "'MCP_ALT_MLL_2025.08_min_formula'!M6",
      "'MCP_ALT_MLL_2025.08_min_formula'!M3"
    ],
    "rollback_of_request_id": "snapshot-ab661f27-ee3f-4c52-addb-5eb51af6bc42",
    "spreadsheet_id": "1q9HYY2b3ha15VwXnsqO98YADw2ebCyY-TqB45VFUvPE",
    "write_requests": [
      {
        "range": "'MCP_ALT_MLL_2025.08_min_formula'!I6",
        "values": [
          [
            ""
          ]
        ]
      },
      {
        "range": "'MCP_ALT_MLL_2025.08_min_formula'!M6",
        "values": [
          [
            ""
          ]
        ]
      },
      {
        "range": "'MCP_ALT_MLL_2025.08_min_formula'!M3",
        "values": [
          [
            ""
          ]
        ]
      }
    ]
  },
  "schema_version": "1.0",
  "snapshot_id": "snapshot-ab661f27-ee3f-4c52-addb-5eb51af6bc42",
  "spreadsheet_id": "1q9HYY2b3ha15VwXnsqO98YADw2ebCyY-TqB45VFUvPE",
  "updated_cells": 3,
  "updated_columns": 2,
  "updated_rows": 2,
  "value_input_option": "USER_ENTERED",
  "write_count": 3
}
